{
  "$schema": "https://json-schema.org/draft/2020-12/schema",
  "$id": "molgap-trajectory-v1",
  "type": "object",
  "required": ["schema", "trajectory_id", "record_mode", "track", "owner", "family_id", "question", "hypothesis", "state_at_start", "actions", "result", "decision"],
  "properties": {
    "decision_state": {"anyOf": [{"$ref": "decision-state-v1.schema.json"}, {"$ref": "decision-state-v2.schema.json"}]},
    "action_replay": {"type": "object", "required": ["inputs_ref", "inputs_sha256", "truth_ref", "truth_sha256"], "properties": {"inputs_ref": {"type": "string"}, "inputs_sha256": {"type": "string", "pattern": "^[0-9a-f]{64}$"}, "truth_ref": {"type": "string"}, "truth_sha256": {"type": "string", "pattern": "^[0-9a-f]{64}$"}}, "additionalProperties": false},
    "schema": {"const": "molgap-trajectory-v1"},
    "trajectory_id": {"type": "string", "minLength": 1},
    "record_mode": {"enum": ["prospective", "retrospective_partial"]},
    "track": {"type": "string", "minLength": 1},
    "owner": {"enum": ["server", "desktop", "shared", "historical"]},
    "family_id": {"type": "string", "minLength": 1},
    "question": {"type": "string", "minLength": 1},
    "hypothesis": {"type": "object"},
    "state_at_start": {"type": "object"},
    "actions": {"type": "array"},
    "result": {"type": "object"},
    "decision": {"type": "object"},
    "readiness": {"type": "object"},
    "comparison_class": {"enum": ["STRICT_CAUSAL", "PAIRED_ENDPOINT", "MATCHED_PREFIX", "CONTEXT_ONLY", "NO_COMPARISON"]},
    "comparison_readiness_ref": {"type": "string", "minLength": 1},
    "comparison_blockers": {"type": "array", "items": {"type": "string", "minLength": 1}},
    "reference_bundle_id": {"type": ["string", "null"]}
  },
  "additionalProperties": false
}
