{
  "actions": [
    {
      "action_id": "A001",
      "attempt_ids": [
        "pcqm-k1-init-noise-100k-s44-v1"
      ],
      "cost_event_ids": [
        "cost-T-pcqm-k1-init-noise-100k-s44-ref_s42-planned",
        "cost-terminal-T-pcqm-k1-init-noise-100k-s44-ref_s42-0",
        "cost-terminal-T-pcqm-k1-init-noise-100k-s44-ref_s42-allocation-0"
      ],
      "evidence_refs": [
        "experiments/pcqm_k1_init_noise_100k/generated/0e783375957dd0fb84fab50341a7205c4292e110f48b583bb2b5339165b52785/ref_s42/recipe.json"
      ],
      "run_ids": [
        "pcqm-k1-init-noise-100k-s44:ref_s42:downstream"
      ],
      "source_commit": "f4e9bcef0e53f07b289082156abdd81ff92c550f",
      "type": "training"
    }
  ],
  "decision": {
    "decision_ref": "experiments/pcqm_k1_init_noise_100k/terminal_decision.md",
    "final": true,
    "next_allowed_actions": [],
    "outcome": "CLOSED",
    "reopen_conditions": []
  },
  "decision_state": {
    "active_reference_ids": [],
    "available_actions": [
      "RUN_PAIRED_100K",
      "DEFER"
    ],
    "budget_snapshot_ref": "experiments/pcqm_k1_init_noise_100k/s44/authority.json",
    "chosen_action": "RUN_PAIRED_100K",
    "policy_id": "pcqm-k1-init-noise-100k",
    "policy_version": "1",
    "role_snapshot_refs": [
      "experiments/pcqm_k1_init_noise_100k/protocol.md"
    ],
    "schema": "molgap-decision-state-v2",
    "snapshot_ref": "experiments/pcqm_k1_init_noise_100k/runs/pcqm-k1-init-noise-100k-s44/prospective/rml_decision_snapshots/43c07be75096b868a9fbab4bcb2c32b33198ee9df9571c9bb2168c40e8d27386.json",
    "snapshot_sha256": "43c07be75096b868a9fbab4bcb2c32b33198ee9df9571c9bb2168c40e8d27386",
    "state_timestamp": "2026-10-29T19:10:00+00:00"
  },
  "family_id": "pcqm-k1-init-noise-100k",
  "hypothesis": {
    "alternative_explanations": [
      "Near misses are real small gains",
      "Data order or dropout noise dominates init noise",
      "K1 is capacity or data limited so noise is irrelevant"
    ],
    "changed_mechanism": "initialization-seed-noise",
    "cheapest_falsifier": "D<1 meV and E<1.5 meV falsifies noise/variance as the cause of null screens.",
    "decision_changed_if_negative": "E < 1.5 meV: same-architecture ensembling has low value at 100K. Falsifier: if D < 1 meV and E < 1.5 meV, the explanation that noise and variance hide gains is wrong, and the limit is capacity, data or contract. Close the init-noise question without retry, continuation, 500K, full training or adoption.",
    "decision_changed_if_positive": "Spread D = max pairwise |MAE difference| among the s42 mean, s43 and s44. D <= 1.0 meV: init noise is small; the past 2-3 meV near misses (typed pair token 2.80, combined simplification 2.16) deserve a 2-init confirmation. 1.0 < D < 2.5 meV: keep the 3 meV gate; any confirmation needs 2 inits per arm. D >= 2.5 meV: single-seed 3 meV screens are underpowered; past near misses become unresolved, not positive, and future screens need >=2 inits per arm. Ensemble gain E = MAE of the 3-init mean prediction against the mean single-run MAE, from saved 50K dev predictions. E >= 3 meV: ensembling beats every module tried and becomes the leading 500K/full candidate for the owner to decide. Rerun drift R = |ref_s42(A) - ref_s42(B)|; R > 0.5 meV means hardware nondeterminism is material. If only one kernel finishes, report one |delta| as a single noise sample and apply no D threshold. No automatic adoption or scale-up.",
    "expected_native_cost_ref": "cost-T-pcqm-k1-init-noise-100k-s44-ref_s42-planned",
    "historical_unknowns": [],
    "hypothesis_id": "H-T-pcqm-k1-init-noise-100k-s44-ref_s42",
    "observed_deficiency": "Every K1 100K screen uses one seed, so the 1-3 meV near misses cannot be separated from initialization noise; no multi-seed 100K K1 result exists (the only attempt, seed 43, ended NO_TRAIN).",
    "related_closed_family_ids": [
      "K1 message norm 100K",
      "K1 hop shell 100K",
      "K1 batch renorm 100K"
    ],
    "supporting_evidence_ids": [
      "ev-terminal-TB-pcqm-k1-ln-norm-160ep-100k-s42-20261021-release1-bn_long",
      "ev-terminal-T-pcqm-k1-message-norm-100k-s42-msgnorm_learned",
      "ev-terminal-T-pcqm-k1-init-forward-500k-single-s42-scratch"
    ]
  },
  "owner": "desktop",
  "question": "How much does K1 post-BN 100K dev MAE change with the initial weights alone (torch seed 44 against the frozen seed 42), and what does a 3-init mean prediction gain over a single run?",
  "record_mode": "prospective",
  "result": {
    "evidence_ids": [
      "ev-terminal-T-pcqm-k1-init-noise-100k-s44-ref_s42"
    ],
    "evidence_refs": [
      "experiments/pcqm_k1_init_noise_100k/runs/pcqm-k1-init-noise-100k-s44/prospective/ref_s42/rml_finalized/v5_evidence.json"
    ]
  },
  "schema": "molgap-trajectory-v1",
  "state_at_start": {
    "budget_snapshot_ref": "experiments/pcqm_k1_init_noise_100k/s44/authority.json",
    "contract_refs": [
      "experiments/pcqm_k1_init_noise_100k/generated/0e783375957dd0fb84fab50341a7205c4292e110f48b583bb2b5339165b52785/ref_s42/recipe.json",
      "experiments/presets/k1-post-bn-100k-data.json",
      "experiments/pcqm_k1_init_noise_100k/s44/experiment.json"
    ],
    "parent_trajectory_ids": [],
    "prior_evidence_ids": [
      "ev-terminal-TB-pcqm-k1-ln-norm-160ep-100k-s42-20261021-release1-bn_long",
      "ev-terminal-T-pcqm-k1-message-norm-100k-s42-msgnorm_learned",
      "ev-terminal-T-pcqm-k1-init-forward-500k-single-s42-scratch"
    ],
    "prior_trajectory_ids": [],
    "reference_ids": [],
    "role_snapshot_refs": [
      "experiments/pcqm_k1_init_noise_100k/protocol.md"
    ],
    "same_run_replay": {
      "arm_id": "ref_s42",
      "comparison_role": "reference",
      "logical_run_id": "pcqm-k1-init-noise-100k-s44",
      "reference_arm_id": "ref_s42",
      "reference_trajectory_id": "T-pcqm-k1-init-noise-100k-s44-ref_s42",
      "reference_trajectory_ref": "experiments/pcqm_k1_init_noise_100k/runs/pcqm-k1-init-noise-100k-s44/prospective/ref_s42/trajectory.json",
      "schema": "molgap-same-run-replay-binding-v1",
      "spec_identity": "8500794cba4b0a1732bde5238c8ed1a2018362d631a5f124cf5713e6f56d1f5d"
    },
    "source_commit": "f4e9bcef0e53f07b289082156abdd81ff92c550f",
    "source_config_identity": "78600b01e493b617e96b020e72b83796882d548842a1b6d2dedc530c0ba210c8"
  },
  "track": "B",
  "trajectory_id": "T-pcqm-k1-init-noise-100k-s44-ref_s42"
}
